{
  "topic": "总替别人的情绪负责，为什么越体贴越累？",
  "audience": "容易因他人语气变化而反复自责的成年观众",
  "duration_seconds": 96,
  "scenario_type": "fictional_demo",
  "facts": [
    {
      "id": "F1",
      "text": "虚构演示：阿宁约朋友见面，对方回复今天先不聊了，她立即反复检查自己的消息并连续道歉；不对应真实人物或聊天记录。",
      "source": "本次创作的虚构情境，非作者亲历或来访案例"
    },
    {
      "id": "F2",
      "text": "一条简短回复不足以确定对方情绪或动机，应保留多种解释。",
      "source": "本次明确的证据边界与编辑判断"
    },
    {
      "id": "F3",
      "text": "讨论如何区分可观察事实、个人猜测与可选择行动，不作诊断或效果承诺。",
      "source": "本次创作brief与风格协议的事实约束"
    }
  ],
  "actor_voice": "own",
  "available_assets": [],
  "cta": "none"
}
